{"schemaVersion":1,"slug":"current-bugfix","runId":"run-bugfix-1","track":"bugfix","tier":"lite","createdAt":"2026-07-23T00:00:00Z","updatedAt":"2026-07-23T00:00:00Z","closedAt":null,"autopilot":false,"currentPhase":"diagnose","phases":{"diagnose":{"status":"in_progress","artifact":null}},"signOff":{"required":false,"signed":false,"date":null,"actor":null,"evidenceRef":null},"lock":null,"artifacts":{},"code":{"baseline":{"repositoryKind":"git","repositoryIdentity":"repo","worktreeIdentity":"worktree","head":"abc","startSnapshotDigest":"sha256:0000000000000000000000000000000000000000000000000000000000000000"},"scope":{"trackedPaths":[],"includedUntrackedPaths":[],"exclusions":[]},"revision":{"status":"unsupported","algorithm":"ff-code-revision-v1","id":null,"diagnostic":"FFI_REVISION_UNSUPPORTED"}},"assurance":{"review":null,"verification":null},"migration":null}
