{"schemaVersion":1,"slug":"locked","runId":"run-locked-1","track":"feature","tier":"full","createdAt":"2026-07-23T00:00:00Z","updatedAt":"2026-07-23T00:00:00Z","closedAt":null,"autopilot":true,"currentPhase":"implement","phases":{},"signOff":{"required":true,"signed":true,"date":"2026-07-23","actor":{"kind":"user","id":null},"evidenceRef":"artifact:spec"},"lock":{"owner":"agent","acquiredAt":"2026-07-23T00:00:00Z"},"artifacts":{},"code":{"baseline":{"repositoryKind":"git","repositoryIdentity":"repo","worktreeIdentity":"worktree","head":"abc","startSnapshotDigest":"sha256:0000000000000000000000000000000000000000000000000000000000000000"},"scope":{"trackedPaths":[],"includedUntrackedPaths":[],"exclusions":[]},"revision":{"status":"unsupported","algorithm":"ff-code-revision-v1","id":null,"diagnostic":"FFI_REVISION_UNSUPPORTED"}},"assurance":{"review":null,"verification":null},"migration":null}
